[
  {
    "id": "claim-0001",
    "statement": "We never had an in-person board meeting. We just talked on the phone.",
    "asserted_by": "Morgan Brill",
    "asserted_in": "Morgan Brill correspondence",
    "proceeding_ids": [],
    "claim_type": "factual_assertion",
    "claim_status": "alleged",
    "contradiction_type": null,
    "supporting_evidence_ids": [
      "evidence-0003"
    ],
    "contradicting_evidence_ids": [],
    "related_event_ids": [],
    "judicial_treatment": null,
    "legal_significance": "Governance dispute over October 15, 2018 meeting",
    "review_status": "unreviewed",
    "notes_internal": null
  },
  {
    "id": "claim-0002",
    "statement": "I can assure you that never happened.",
    "asserted_by": "Morgan Brill",
    "asserted_in": "Morgan Brill correspondence on ROFR",
    "proceeding_ids": [],
    "claim_type": "factual_assertion",
    "claim_status": "alleged",
    "contradiction_type": "documentary_conflict",
    "supporting_evidence_ids": [
      "evidence-0004"
    ],
    "contradicting_evidence_ids": [
      "evidence-0002"
    ],
    "related_event_ids": [],
    "judicial_treatment": null,
    "legal_significance": "ROFR waiver authenticity",
    "review_status": "unreviewed",
    "notes_internal": null
  },
  {
    "id": "claim-0003",
    "statement": "This is definitely not true.",
    "asserted_by": "Morgan Brill",
    "asserted_in": "Morgan Brill correspondence",
    "proceeding_ids": [],
    "claim_type": "factual_assertion",
    "claim_status": "alleged",
    "contradiction_type": null,
    "supporting_evidence_ids": [],
    "contradicting_evidence_ids": [],
    "related_event_ids": [],
    "judicial_treatment": null,
    "legal_significance": "Dispute over supposed 60/40 building-sale split agreement",
    "review_status": "unreviewed",
    "notes_internal": null
  },
  {
    "id": "claim-0004",
    "statement": "Mike put his HVAC on the coping wall outside the window of the pink bedroom.",
    "asserted_by": "Morgan Brill",
    "asserted_in": "Morgan Brill correspondence",
    "proceeding_ids": [],
    "claim_type": "factual_assertion",
    "claim_status": "alleged",
    "contradiction_type": null,
    "supporting_evidence_ids": [],
    "contradicting_evidence_ids": [],
    "related_event_ids": [],
    "judicial_treatment": null,
    "legal_significance": "Location and history of HVAC equipment",
    "review_status": "unreviewed",
    "notes_internal": null
  },
  {
    "id": "claim-0005",
    "statement": "He just has a completely bonkers idea about the value of that place that is in no way linked to reality.",
    "asserted_by": "Morgan Brill",
    "asserted_in": "Morgan Brill correspondence",
    "proceeding_ids": [],
    "claim_type": "factual_assertion",
    "claim_status": "alleged",
    "contradiction_type": null,
    "supporting_evidence_ids": [],
    "contradicting_evidence_ids": [],
    "related_event_ids": [],
    "judicial_treatment": null,
    "legal_significance": "Assessment of Bleich valuation behavior",
    "review_status": "unreviewed",
    "notes_internal": null
  },
  {
    "id": "claim-0006",
    "statement": "It seems like he’s lying about a lot of things!! What is wrong with him?!",
    "asserted_by": "Morgan Brill",
    "asserted_in": "Morgan Brill correspondence",
    "proceeding_ids": [],
    "claim_type": "factual_assertion",
    "claim_status": "alleged",
    "contradiction_type": null,
    "supporting_evidence_ids": [],
    "contradicting_evidence_ids": [],
    "related_event_ids": [],
    "judicial_treatment": null,
    "legal_significance": "Assessment of credibility",
    "review_status": "unreviewed",
    "notes_internal": null
  },
  {
    "id": "claim-0007",
    "statement": "as of yesterday I am officially resigning as Co-President of the board of 13 Harrison St",
    "asserted_by": "Morgan Brill",
    "asserted_in": "Morgan Brill resignation email",
    "proceeding_ids": [],
    "claim_type": "factual_assertion",
    "claim_status": "alleged",
    "contradiction_type": null,
    "supporting_evidence_ids": [
      "evidence-0005"
    ],
    "contradicting_evidence_ids": [],
    "related_event_ids": [
      "event-0012"
    ],
    "judicial_treatment": null,
    "legal_significance": "Timing of resignation",
    "review_status": "unreviewed",
    "notes_internal": null
  },
  {
    "id": "claim-0008",
    "statement": "I am not interested in having an official unit holders meeting as we just had one.",
    "asserted_by": "Michael Bleich",
    "asserted_in": "November 26, 2018 email",
    "proceeding_ids": [],
    "claim_type": "factual_assertion",
    "claim_status": "alleged",
    "contradiction_type": null,
    "supporting_evidence_ids": [],
    "contradicting_evidence_ids": [],
    "related_event_ids": [],
    "judicial_treatment": null,
    "legal_significance": "Governance blockade",
    "review_status": "unreviewed",
    "notes_internal": null
  },
  {
    "id": "claim-0009",
    "statement": "Tom is going to do some light work on the skylight air conditioning and ventilation above our back room",
    "asserted_by": "Michael Bleich",
    "asserted_in": "December 1, 2018 email from Michael Bleich",
    "proceeding_ids": [],
    "claim_type": "factual_assertion",
    "claim_status": "alleged",
    "contradiction_type": null,
    "supporting_evidence_ids": [
      "evidence-0006"
    ],
    "contradicting_evidence_ids": [],
    "related_event_ids": [
      "event-0021"
    ],
    "judicial_treatment": null,
    "legal_significance": "Rooftop HVAC acknowledgement",
    "review_status": "unreviewed",
    "notes_internal": null
  },
  {
    "id": "claim-0010",
    "statement": "some architectural planning around the possible conversion of our apartment into office or retail space",
    "asserted_by": "Michael Bleich",
    "asserted_in": "December 1, 2018 email from Michael Bleich",
    "proceeding_ids": [],
    "claim_type": "factual_assertion",
    "claim_status": "alleged",
    "contradiction_type": null,
    "supporting_evidence_ids": [
      "evidence-0006"
    ],
    "contradicting_evidence_ids": [],
    "related_event_ids": [
      "event-0021"
    ],
    "judicial_treatment": null,
    "legal_significance": "Possible commercial conversion of Unit 1",
    "review_status": "unreviewed",
    "notes_internal": null
  },
  {
    "id": "claim-0011",
    "statement": "There is a water leak coming from your unit into ours.",
    "asserted_by": "Michael Bleich",
    "asserted_in": "July 7, 2019 email from Michael Bleich",
    "proceeding_ids": [],
    "claim_type": "factual_assertion",
    "claim_status": "alleged",
    "contradiction_type": null,
    "supporting_evidence_ids": [
      "evidence-0007"
    ],
    "contradicting_evidence_ids": [],
    "related_event_ids": [
      "event-0026"
    ],
    "judicial_treatment": null,
    "legal_significance": "Leak narrative",
    "review_status": "unreviewed",
    "notes_internal": null
  },
  {
    "id": "claim-0012",
    "statement": "My interest is simply to sell unit 1 with as little friction as possible.",
    "asserted_by": "Michael Bleich",
    "asserted_in": "February 28, 2019 email from Michael Bleich",
    "proceeding_ids": [
      "proc-0001"
    ],
    "claim_type": "factual_assertion",
    "claim_status": "alleged",
    "contradiction_type": null,
    "supporting_evidence_ids": [
      "evidence-0010"
    ],
    "contradicting_evidence_ids": [],
    "related_event_ids": [],
    "judicial_treatment": null,
    "legal_significance": "Stated objective after filing",
    "review_status": "unreviewed",
    "notes_internal": null
  },
  {
    "id": "claim-0013",
    "statement": "We are getting a lot of interest currently around the new asking price of $3.9mm.",
    "asserted_by": "Michael Bleich",
    "asserted_in": "February 28, 2019 email from Michael Bleich",
    "proceeding_ids": [
      "proc-0001"
    ],
    "claim_type": "factual_assertion",
    "claim_status": "alleged",
    "contradiction_type": "documentary_conflict",
    "supporting_evidence_ids": [
      "evidence-0010"
    ],
    "contradicting_evidence_ids": [
      "evidence-0011"
    ],
    "related_event_ids": [],
    "judicial_treatment": null,
    "legal_significance": "Market-interest claim",
    "review_status": "unreviewed",
    "notes_internal": null
  },
  {
    "id": "claim-0014",
    "statement": "If you do have such an interest I would encourage you to put in an offer.",
    "asserted_by": "Michael Bleich",
    "asserted_in": "February 28, 2019 email from Michael Bleich",
    "proceeding_ids": [
      "proc-0001"
    ],
    "claim_type": "factual_assertion",
    "claim_status": "alleged",
    "contradiction_type": null,
    "supporting_evidence_ids": [
      "evidence-0010"
    ],
    "contradicting_evidence_ids": [],
    "related_event_ids": [],
    "judicial_treatment": null,
    "legal_significance": "Buyout pressure",
    "review_status": "unreviewed",
    "notes_internal": null
  },
  {
    "id": "claim-0015",
    "statement": "the price that the seller wanted to list the apartment for",
    "asserted_by": "David Kornmeier",
    "asserted_in": "Kornmeier deposition",
    "proceeding_ids": [
      "proc-0001"
    ],
    "claim_type": "factual_assertion",
    "claim_status": "alleged",
    "contradiction_type": null,
    "supporting_evidence_ids": [
      "evidence-0012"
    ],
    "contradicting_evidence_ids": [],
    "related_event_ids": [
      "event-0027"
    ],
    "judicial_treatment": null,
    "legal_significance": "Source of $6.5M listing price",
    "review_status": "unreviewed",
    "notes_internal": null
  },
  {
    "id": "claim-0016",
    "statement": "determined that those were not legal bedrooms",
    "asserted_by": "David Kornmeier",
    "asserted_in": "Kornmeier deposition",
    "proceeding_ids": [
      "proc-0001"
    ],
    "claim_type": "factual_assertion",
    "claim_status": "alleged",
    "contradiction_type": null,
    "supporting_evidence_ids": [